Inputs,Strategy,Activities,Output,Immediate Outcomes <1year,Intermediate Outcomes 1-5 years,Long-term Outcomes (5-10+ years)
"ACEs screening tool and scores
Behavioral and emotional screening tools
Cafe Momentum Restaurant Skills Certification
Case management
Community and partners
Community resource and referral guide
Community services center
Curriculum and playbook
Funding
Guest speakers
Program materials and equipment
Restaurant location
Safety and security policies and procedures
ServSafe Food Handler Certification Course & Exam
Staff
Technology
The Momentum Model
Tiers of Success
Transportation
Trauma-informed care training",Basic needs resource navigation,"Community resources and referrals for basic needs and stabilization (housing, food assistance, healthcare, child care, government-issued or state IDs, government services, legal aid, substance abuse support, family support)

Critical document support 

Provide donated essential items and personal care items

Resource navigation education
","Referrals provided by category (number of)
IDs obtained by youth (number of)","Increased access to health care services
Increased access to basic needs",Increased ability to navigate and use services,"Improved social-emotional well-being 
Increased sense of agency
Increased education attainment 
Increased job stability 
Decreased justice system involvement"
,Mental health and trauma recovery support,"Mental health meeting and service planning

Adverse Childhood Experience (ACE) screening

Counseling/therapy

Behavioral and emotional screening","Mental health service plans (number of) 
Individual therapy sessions (number of)
Group therapy sessions (number of)  
Behavioral screenings (number of) 
Interns with ACE screenings (percent of)
ACEs score (average)
Restorative circles (number of)","Improved social-emotional skills
Improved self-esteem and self-efficacy 
Improved conflict management skills","Increase in healthy relationships 
High school graduation or GED attainment
Increased credential attainment ",
,Life skills and personal development,"Goal setting and support

Enrichment participation (community activities like attending a musical, visiting a museum, etc.)

Youth empowerment and education (education on rights, address discrimination, navigating systems, prevent predatory, for-profit education schemes, etc.) 

Sexual health and healthy relationships education

Financial education (personal budget, bank account, Paycheck, payroll and withholding workshops)

Family visits 

Online and social media etiquette

Professional or Transferrable Workplace Skill Development
","Case management (hours of)
Enrichment (hours of)
Tiers of Success completed (number of)","Improved social-emotional skills
Improved self-esteem and self-efficacy
Increased sense of belonging
Expand professional network 
Increased employability 
","Increase in healthy relationships
Increased social capital
Increased credential attainment 
Increased employment",
,Educational enrichment,"Education planning

High school and GED enrollment asssitance 

School attendance tracking

Academic tutoring and support

Post-secondary prep (test prep, college application support, scholarship and FAFSA support, interview prep, college tours, guest speakers)","Interns enrolled in high school or GED program (percentage of)
Interns making academic progress (number of)
","Increased academic engagement 
Increased access to educational opportunities ","High school graduation or GED attainment
Increased credential attainment ",
,Restaurant industry skill-building,"Cafe Momentum Restaurant Skills Certification 

Restaurant training and employment 

Industry-recognized certification (ServSafe Food Handlers)","ServSafe certifications (number of)
Station certifications earned (number of)
Skills certifications earned (number of)
Paid hours (number of) 
Wages earned on shift at Restaurant (average) 
Wages earned on key learning activities (average)","Improved self-esteem and self-efficacy
Improved interpersonal skills 
Increased employability ",Increased employment,
,Job attainment support,"Career exploration activities 

Job search workshops and 1:1 coaching

Professional networking","Externships completed (number of) 
Job shadows completed (number of) 
Informational interviews (number of) 
Jobs attained (number of) 
Starting wage (average) 
Professional connections (number of) ","Expand professional network 
Improved interpersonal skills 
Improved self-esteem and self-efficacy","Increased social capital
Increased credential attainment 
Increased employment 
",
,Violence prevention*,"Violence prevention education 

Transportation planning

Deescalation and conflict mediation ","Workshops attended (number of) 
De-escalation incidents (number of) 
","Improved conflict management skills 
Improved interpersonal skills 
Increased sense of safety at Café Momentum ","Increase in healthy relationships 
Avoid justice system involvement",
,Exiting the justice system,"Community Service Hours (Give Back Hours)

Transition planning and support (1:1 with Case Management to ensure they're current with Probation Requirements, and when off of probation)

Court and trial support

Relationship-building with probation officers (reporting etc.)","Youth in compliance with probation (percentage of)
Youth in alignment with restitution (number of)
Community service hours completed (number of) 
Staff court appearances (number of) 
Staff-probation officer relationships (number of) ","Improved self-esteem and self-efficacy 
Increased progress towards justice system exit ",Exit justice system ,
,Post-internship planning and support ,"Post-internship planning 

Outreach and follow-up

Resource referrals

Job search assistance

Community-building activities and events","Interns exiting program (number of)
Interns enrolled in education program at exit (number of)
Interns employed at exit (number of)
Post-internship engagements (number of)
Referrals provided (number of)
Community-building activities and events (number of) ","Expand professional network 
Increased sense of belonging
Increased access to basic needs","Increased social capital
Increased employment
Increased credential attainment ",